{
  "lenspub": "0.1",
  "type": "LensManifest",
  "metadata": {
    "name": "Avery's Daily Lens",
    "description": "Avery's personal daily-driver lens. Demonstrates a typical private manifest: three Domain Scopes with per-domain Adaptation Policies (politics locked, technical research adaptive, entertainment explorer), mixed positive and negative topic priorities, explicit source trust and distrust, remote inference opted in for technical research only, an advisory pinned subscription to a newsroom Organization Lens, and a version history of superseded versions. It has no id and no proof because it is not published.",
    "lensVersion": "1.4.2",
    "created": "2026-03-02T08:00:00Z",
    "modified": "2026-07-05T17:31:00Z",
    "language": "en"
  },
  "domains": [
    {
      "id": "technical-research",
      "label": "Technical research",
      "description": "Papers, benchmarks, engineering write-ups, and systems documentation."
    },
    {
      "id": "politics",
      "label": "Politics",
      "description": "Elections, legislation, and policy coverage."
    },
    {
      "id": "entertainment",
      "label": "Entertainment",
      "description": "Film, television, games, and music."
    }
  ],
  "interpretation": {
    "priorities": [
      {
        "topic": "primary sources",
        "weight": 0.9,
        "rationale": "Prefer the paper, the filing, or the dataset over commentary about it."
      },
      {
        "topic": "reproducible benchmarks",
        "weight": 0.7,
        "domains": ["technical-research"],
        "rationale": "Benchmark claims without published artifacts have misled me before."
      },
      {
        "topic": "horse-race framing",
        "weight": -0.6,
        "domains": ["politics"],
        "rationale": "Surface policy substance above polling narratives."
      },
      {
        "topic": "spoilers",
        "weight": -0.8,
        "domains": ["entertainment"],
        "rationale": "Warn me before plot details are revealed."
      },
      {
        "topic": "engagement-bait headlines",
        "weight": -0.5,
        "rationale": "De-emphasize overlays on content whose headline contradicts its body."
      }
    ],
    "sources": {
      "trusted": [
        {
          "origin": "arxiv.org",
          "weight": 0.8,
          "note": "Preprints: strong signal, still unreviewed."
        },
        {
          "origin": "https://lwn.net",
          "weight": 0.9,
          "note": "Consistently careful kernel and systems reporting."
        },
        {
          "origin": "did:web:meridianledger.example",
          "weight": 0.7,
          "note": "Newsroom whose sourcing standards I also subscribe to."
        }
      ],
      "distrusted": [
        {
          "origin": "clickcast.example",
          "weight": 0.9,
          "note": "Recycles wire copy under misleading headlines."
        }
      ],
      "requireProvenance": ["citations", "publication-date"]
    },
    "presentation": {
      "annotations": true,
      "summaries": "brief",
      "evidenceIndicators": true,
      "counterpoints": "on-request",
      "primarySourceExpansion": true,
      "explanationDisplay": "on-request"
    }
  },
  "adaptation": {
    "defaultPolicy": "balanced",
    "domainPolicies": [
      { "domain": "politics", "policy": "locked" },
      { "domain": "technical-research", "policy": "adaptive" },
      { "domain": "entertainment", "policy": "explorer" }
    ]
  },
  "privacy": {
    "remoteInference": {
      "allowed": true,
      "domains": ["technical-research"]
    }
  },
  "subscriptions": [
    {
      "lens": "https://meridianledger.example/lenspub/newsroom-standards.json",
      "pinnedVersion": "3.2.0",
      "domains": ["politics"],
      "trust": "advisory"
    }
  ],
  "versionHistory": [
    {
      "lensVersion": "1.3.0",
      "hash": "a3f1c2e8d94b7605c1a2e94f8b3d6c7a90e1f2b3c4d5e6f708192a3b4c5d6e7f",
      "date": "2026-05-14T18:22:00Z",
      "proposalId": "lcp-2026-05-14-003"
    },
    {
      "lensVersion": "1.4.0",
      "hash": "5b9e2f7c8d1a4e6f9c0b3a2d5e8f1c4b7a0d3e6f9c2b5a8d1e4f7c0b3a6d9e2f",
      "date": "2026-06-02T09:10:00Z",
      "proposalId": "lcp-2026-06-02-001"
    },
    {
      "lensVersion": "1.4.1",
      "hash": "c7d0e3f6a9b2c5d8e1f4a7b0c3d6e9f2a5b8c1d4e7f0a3b6c9d2e5f8a1b4c7d0",
      "date": "2026-06-20T21:45:00Z",
      "proposalId": "lcp-2026-06-20-002"
    }
  ]
}
